{
  "firm_name": "FTMO",
  "version": 2,
  "effective_date": "2026-04-16",
  "website": "https://ftmo.com",
  "description": "Global forex/indices/commodities prop firm. 2-step evaluation (Challenge + Verification). No time limit.",
  "markets": ["forex", "indices", "commodities", "crypto"],
  "evaluation_type": "2-step",
  "accounts": [
    { "size": 10000, "currency": "USD", "challenge_fee": 155, "profit_target_phase1_pct": 10, "profit_target_phase2_pct": 5 },
    { "size": 25000, "currency": "USD", "challenge_fee": 250, "profit_target_phase1_pct": 10, "profit_target_phase2_pct": 5 },
    { "size": 50000, "currency": "USD", "challenge_fee": 345, "profit_target_phase1_pct": 10, "profit_target_phase2_pct": 5 },
    { "size": 100000, "currency": "USD", "challenge_fee": 540, "profit_target_phase1_pct": 10, "profit_target_phase2_pct": 5 },
    { "size": 200000, "currency": "USD", "challenge_fee": 1080, "profit_target_phase1_pct": 10, "profit_target_phase2_pct": 5 }
  ],
  "rules": [
    {
      "type": "daily_loss",
      "value": 5,
      "unit": "percent_of_initial_balance",
      "description": "Maximum daily loss is 5% of INITIAL account balance (not previous day balance). Recalculated at midnight CE(S)T using: max(account_balance_at_midnight, initial_balance) - 5% * initial_balance. Includes closed P/L, floating P/L, commissions, and swaps. Equity-based.",
      "calculation_base": "equity",
      "calculation_note": "The daily loss limit is always 5% of INITIAL capital. However, if your balance at midnight is higher than initial, the floor is calculated from that higher balance. Example: $100K account, balance at midnight = $105K, floor = $105K - $5K = $100K (not $95K).",
      "reset_time": "00:00 CET",
      "breach_action": "account_violation"
    },
    {
      "type": "max_drawdown",
      "value": 10,
      "unit": "percent_of_initial_balance",
      "description": "Account equity must not drop below 90% of INITIAL account balance at any time. This is static (non-trailing) — the floor never moves. Example: $100K account, equity floor = $90K forever.",
      "trailing": false,
      "calculation_base": "initial_balance",
      "breach_action": "account_violation"
    },
    {
      "type": "min_trading_days",
      "value": 4,
      "unit": "calendar_days",
      "description": "Must trade on at least 4 calendar days during each phase."
    },
    {
      "type": "time_limit",
      "value": null,
      "unit": "days",
      "description": "No time limit. Traders can take as long as needed to reach profit target."
    },
    {
      "type": "news_restriction",
      "value": true,
      "unit": "boolean",
      "description": "On standard accounts, cannot open or close trades within 2 minutes before and after high-impact news events (as defined by FTMO's economic calendar). Applies to standard accounts only, not swing accounts.",
      "applies_to": "standard_accounts_only",
      "window_minutes_before": 2,
      "window_minutes_after": 2
    }
  ],
  "profit_split": { "base": 80, "max": 90, "unit": "percent" },
  "sources": [
    "https://ftmo.com/en/trading-objectives/",
    "https://academy.ftmo.com/lesson/maximum-daily-loss/",
    "https://academy.ftmo.com/lesson/maximum-loss/",
    "https://www.edgeflo.com/blog/ftmo-rules"
  ]
}
